[
  {
    "id": "r-traverse",
    "name": "Traverse",
    "tagline": "Labuan Bajo to Larantuka, west to east across the spine of Flores",
    "description": "The primary concept course: ten sections from the Komodo gateway to the Portuguese-Catholic east, crossing the island's volcanic spine repeatedly rather than following the paved Trans-Flores highway's single 670 km line. Single stage, self-supported, fixed route, with cultural checkpoints at villages that have agreed to host the race. All figures are concept sketches, drawn from docs/route-concept.md, pending the first scouting season.",
    "audience": [
      "stakeholder",
      "scout",
      "public"
    ],
    "anchors": [
      "n-labuan-bajo",
      "n-sano-nggoang",
      "n-werang",
      "n-dintor",
      "n-denge",
      "n-wae-rebo",
      "n-todo",
      "n-iteng",
      "n-ruteng",
      "n-ranamese",
      "n-liang-bua",
      "n-reo",
      "n-pota",
      "n-riung",
      "n-soa",
      "n-bajawa",
      "n-bena",
      "n-aimere",
      "n-mataloko",
      "n-boawae",
      "n-mbay",
      "n-nangaroro",
      "n-penggajawa",
      "n-ende",
      "n-detusoko",
      "n-moni",
      "n-kelimutu",
      "n-wolojita",
      "n-nggela",
      "n-koka",
      "n-sikka",
      "n-lela",
      "n-maumere",
      "n-watublapi",
      "n-blidit",
      "n-waiterang",
      "n-talibura",
      "n-larantuka"
    ],
    "segments": [
      "s-labuan-bajo-sano-nggoang-a",
      "s-sano-nggoang-werang-a",
      "s-werang-dintor-a",
      "s-dintor-denge-a",
      "s-denge-wae-rebo-a",
      "s-wae-rebo-todo-a",
      "s-todo-iteng-a",
      "s-iteng-ruteng-a",
      "s-ruteng-ranamese-a",
      "s-ranamese-liang-bua-a",
      "s-liang-bua-reo-a",
      "s-reo-pota-a",
      "s-pota-riung-a",
      "s-riung-soa-a",
      "s-soa-bajawa-a",
      "s-bajawa-bena-a",
      "s-bena-aimere-a",
      "s-aimere-mataloko-a",
      "s-mataloko-boawae-a",
      "s-boawae-mbay-a",
      "s-mbay-nangaroro-a",
      "s-nangaroro-penggajawa-a",
      "s-penggajawa-ende-a",
      "s-ende-detusoko-a",
      "s-detusoko-moni-a",
      "s-moni-kelimutu-a",
      "s-kelimutu-wolojita-a",
      "s-wolojita-nggela-a",
      "s-nggela-koka-a",
      "s-koka-sikka-a",
      "s-sikka-lela-a",
      "s-lela-maumere-a",
      "s-maumere-watublapi-a",
      "s-watublapi-blidit-a",
      "s-blidit-waiterang-a",
      "s-waiterang-talibura-a",
      "s-talibura-larantuka-a"
    ],
    "status": "concept",
    "target_km_range": [
      1120,
      1540
    ],
    "time_limit_days": 13,
    "notes": "West to east because the prevailing dry-season wind is from the east-south-east and because the island's story reads that way, from Komodo and the Manggarai highlands to the Catholic-Portuguese east. Dry-season window late June to September; August is the safest weather bet and also the busiest month in Labuan Bajo. Variant B alternatives exist in data/segments.geojson for the same node pairs (Wae Rebo out-and-back, Boawae→Nangaroro direct, Lewotobi highway corridor) but are not part of this route's selected chain; they are candidates for scouts to evaluate against variant A.",
    "stats": {
      "length_km": 1132.091,
      "ascent_m": 72863.9,
      "descent_m": 72839.0,
      "min_elev_m": 0.0,
      "max_elev_m": 1825.1,
      "unpaved_pct": 85.4,
      "profile_ref": "r-traverse",
      "hab_km": 31.0,
      "segments_by_status": {
        "concept": 37
      }
    }
  },
  {
    "id": "r-ultra",
    "name": "Ultra",
    "tagline": "The Traverse plus the Manggarai Timur interior, the Bola coast loop, and the Inerie circuit",
    "description": "An extended variant for stakeholders and scouts weighing a longer, more remote course: it trades the direct Liang Bua→Reo→Pota corridor for the unscouted Ruteng→Borong→Elar→Pota interior of Manggarai Timur, adds the Maumere→Bola→Watublapi south-coast loop before Egon, and swaps the Inerie shoulder traverse for a full circuit of the mountain. A geometry defect in the original concept-sketch vertices for five of these loop segments (they wandered 30-60 km through unrelated terrain before snapping back to the real endpoint) made the loops look like they added the route concept's stated +120-160 km / +50-70 km / +40-60 km; corrected to plausible corridors between their real endpoints, they add roughly +19 km, +37 km and +1 km instead. Every added kilometre here is even less scouted than the Traverse; treat this as a distance ceiling to test appetite for, not a proposal ready for a village agreement.",
    "audience": [
      "stakeholder",
      "scout"
    ],
    "anchors": [
      "n-labuan-bajo",
      "n-sano-nggoang",
      "n-werang",
      "n-dintor",
      "n-denge",
      "n-wae-rebo",
      "n-todo",
      "n-iteng",
      "n-ruteng",
      "n-borong",
      "n-elar",
      "n-pota",
      "n-riung",
      "n-soa",
      "n-bajawa",
      "n-bena",
      "n-aimere",
      "n-mataloko",
      "n-boawae",
      "n-mbay",
      "n-nangaroro",
      "n-penggajawa",
      "n-ende",
      "n-detusoko",
      "n-moni",
      "n-kelimutu",
      "n-wolojita",
      "n-nggela",
      "n-koka",
      "n-sikka",
      "n-lela",
      "n-maumere",
      "n-bola",
      "n-watublapi",
      "n-blidit",
      "n-waiterang",
      "n-talibura",
      "n-larantuka"
    ],
    "segments": [
      "s-labuan-bajo-sano-nggoang-a",
      "s-sano-nggoang-werang-a",
      "s-werang-dintor-a",
      "s-dintor-denge-a",
      "s-denge-wae-rebo-a",
      "s-wae-rebo-todo-a",
      "s-todo-iteng-a",
      "s-iteng-ruteng-a",
      "s-ruteng-borong-a",
      "s-borong-elar-a",
      "s-elar-pota-a",
      "s-pota-riung-a",
      "s-riung-soa-a",
      "s-soa-bajawa-a",
      "s-bajawa-bena-a",
      "s-bena-aimere-b",
      "s-aimere-mataloko-a",
      "s-mataloko-boawae-a",
      "s-boawae-mbay-a",
      "s-mbay-nangaroro-a",
      "s-nangaroro-penggajawa-a",
      "s-penggajawa-ende-a",
      "s-ende-detusoko-a",
      "s-detusoko-moni-a",
      "s-moni-kelimutu-a",
      "s-kelimutu-wolojita-a",
      "s-wolojita-nggela-a",
      "s-nggela-koka-a",
      "s-koka-sikka-a",
      "s-sikka-lela-a",
      "s-lela-maumere-a",
      "s-maumere-bola-a",
      "s-bola-watublapi-a",
      "s-watublapi-blidit-a",
      "s-blidit-waiterang-a",
      "s-waiterang-talibura-a",
      "s-talibura-larantuka-a"
    ],
    "status": "concept",
    "target_km_range": [
      1150,
      1350
    ],
    "notes": "A geometry-verification pass found five of this route's loop-only segments (s-ruteng-borong-a, s-borong-elar-a, s-elar-pota-a, s-bena-aimere-b, s-maumere-bola-a, s-bola-watublapi-a) had concept-sketch vertices that wandered 30-60 km through unrelated terrain before snapping back to the real endpoint -- a shared sketch/generation defect, not a deliberate long detour. Once redrawn to a plausible corridor (1.3-2.5x the straight-line distance between the segment's own endpoints) between the real endpoints, the route's total dropped from a previously-computed 1573.5 km to about 1189 km: lower than before, not higher, because the buggy geometry happened to be long, not because real distance was removed. target_km_range is lowered to [1150,1350] to match what the corrected geometry actually supports, rather than left at the original [1600,1900], which assumed docs/route-concept.md's +120-160 km / +50-70 km / +40-60 km loop estimates -- those aren't achievable while every segment also stays within a geodesically plausible corridor (see each loop segment's own open_questions for the arithmetic). Reaching 1600+ km honestly would need either a genuinely new loop (the Riung→Mbay by the coast and the Bajawa plateau option below, still not built as segments) or accepting less plausible, longer-corridor geometry than the verification pass allows; docs/route-concept.md's loop-distance estimates should be revisited. A fourth optional loop named in the concept (Riung→Mbay by the coast and the Bajawa plateau, +60-90 km) is not yet built as segments here because it revisits both the coast and the plateau rather than offering a simple point-to-point alternative; it remains a candidate for a future revision of this route.",
    "stats": {
      "length_km": 1189.434,
      "ascent_m": 81024.6,
      "descent_m": 81045.0,
      "min_elev_m": 0.0,
      "max_elev_m": 2211.5,
      "unpaved_pct": 86.1,
      "profile_ref": "r-ultra",
      "hab_km": 27.0,
      "segments_by_status": {
        "concept": 37
      }
    }
  }
]
